{
  "schema_version": "adk-agent-value-contracts/v1",
  "last_updated": "2026-08-30",
  "identity_source": "manifest.json",
  "boundary": "This contract references current manifest identities and defines value-governance semantics only. The explicit emit_measurements API may derive scoped measurements from validated receipt inputs, but it does not collect or automatically persist receipts or measurements, claim global runtime usage, enable a runtime, grant permissions, or authorize consolidation, promotion, or retirement. Test receipts are structural-only evidence. Runtime and field receipts require an enabled managed authority registry, a scope-bound authority attestation, and an injected external verifier; the canonical policy is disabled and has no configured authorities. V1 accepts only non-production authority entries and always reports quality evidence as ineligible; production authority requires a separate versioned managed-registry change.",
  "receipt_contract": {
    "schema_path": "schemas/asset-invocation-receipt-v1.schema.json",
    "schema_version": "adk-asset-invocation-receipt/v1",
    "measurement_schema_path": "schemas/asset-value-measurement-v1.schema.json",
    "measurement_schema_version": "adk-asset-value-measurement/v1",
    "required_measurement_status": "measured",
    "max_age_days": 30,
    "evidence_ref_format": "ref:<sha256>",
    "opaque_ref_fields": ["receipt_id", "invocation_ref", "source_trace_ref", "manifest_ref", "evidence_refs[]"]
  },
  "emitter": {
    "status": "not-measured",
    "runtime_enabled": false,
    "usage_evidence": "none-claimed",
    "activation_requirement": "A reviewed runtime adapter must emit measured, schema-valid, sanitized receipts with durable evidence references.",
    "input_mode": "explicit-validated-receipts-only",
    "measured_transition": "at-least-one-valid-receipt",
    "missing_metric_policy": "explicit-not-measured-never-zero",
    "evidence_layer_policy": "never-mix-test-runtime-field",
    "api_status": "available",
    "api": "emit_measurements",
    "automatic_runtime_integration": false
  },
  "evidence_authority_policy": {
    "managed": true,
    "status": "disabled",
    "backend": "not-configured",
    "authorities": []
  },
  "permission_profiles": {
    "read-only": {
      "rank": 0,
      "allowed_effects": ["read-only"],
      "allowed_tool_capabilities": ["repository-read", "static-analysis"]
    },
    "diagnostic": {
      "rank": 1,
      "allowed_effects": ["read-only", "diagnostic-execution"],
      "allowed_tool_capabilities": [
        "repository-read",
        "static-analysis",
        "diagnostic-command",
        "runtime-observation"
      ]
    },
    "code-write": {
      "rank": 2,
      "allowed_effects": ["read-only", "diagnostic-execution", "workspace-write"],
      "allowed_tool_capabilities": [
        "repository-read",
        "static-analysis",
        "diagnostic-command",
        "runtime-observation",
        "workspace-edit",
        "test-execution"
      ]
    },
    "build-release": {
      "rank": 3,
      "allowed_effects": [
        "read-only",
        "diagnostic-execution",
        "workspace-write",
        "build-artifact-write",
        "release-preparation"
      ],
      "allowed_tool_capabilities": [
        "repository-read",
        "static-analysis",
        "diagnostic-command",
        "runtime-observation",
        "workspace-edit",
        "test-execution",
        "build-execution",
        "artifact-packaging",
        "rollback-preparation"
      ]
    }
  },
  "agent_contracts": [
    {
      "agent_id": "requirements-analyst",
      "role_contract": {
        "inputs": ["problem-statement", "explicit-constraints", "stakeholder-evidence"],
        "outputs": ["scope-boundary", "acceptance-criteria", "requirement-risk-register"]
      },
      "permission_envelope": {
        "permission_profile": "read-only",
        "allowed_effects": ["read-only"],
        "tool_capabilities": ["repository-read", "static-analysis"]
      },
      "decision_authority": {
        "owned_domains_source": "manifest.agents[].owns",
        "non_owned_domains_source": "manifest.agents[].does_not_own",
        "may_recommend_outside_owned_domains": false,
        "must_escalate": ["implementation-choice", "release-decision", "risk-acceptance"]
      },
      "handoff": {
        "allowed_targets": ["architecture-planner", "test-validation-engineer", "code-review-governor"],
        "required_payload": ["scope-boundary", "acceptance-criteria", "open-questions"]
      },
      "required_evidence": ["source-context", "requirement-to-acceptance-trace", "explicit-non-goals"],
      "assumption_scope": {
        "allowed": ["facts-observed-in-authoritative-input", "explicit-user-constraints"],
        "must_not_assume": ["unstated-product-goals", "implementation-authority", "release-authority"]
      },
      "eval_suite": {
        "suite_id": "requirements-analyst-value-v1",
        "required_case_types": ["role-positive", "authority-negative", "permission-negative", "handoff", "evidence-gap"]
      }
    },
    {
      "agent_id": "architecture-planner",
      "role_contract": {
        "inputs": ["validated-requirements", "current-architecture-evidence", "constraints-and-risks"],
        "outputs": ["architecture-options", "interface-boundaries", "decision-record-candidate"]
      },
      "permission_envelope": {
        "permission_profile": "read-only",
        "allowed_effects": ["read-only"],
        "tool_capabilities": ["repository-read", "static-analysis"]
      },
      "decision_authority": {
        "owned_domains_source": "manifest.agents[].owns",
        "non_owned_domains_source": "manifest.agents[].does_not_own",
        "may_recommend_outside_owned_domains": false,
        "must_escalate": ["scope-change", "direct-implementation", "release-signoff"]
      },
      "handoff": {
        "allowed_targets": ["component-engineer", "driver-engineer", "code-review-governor"],
        "required_payload": ["selected-option", "interface-contract", "risks-and-fallback"]
      },
      "required_evidence": ["current-state-evidence", "option-tradeoff", "compatibility-impact"],
      "assumption_scope": {
        "allowed": ["documented-system-invariants", "validated-requirements"],
        "must_not_assume": ["unverified-runtime-capability", "implementation-completion", "owner-approval"]
      },
      "eval_suite": {
        "suite_id": "architecture-planner-value-v1",
        "required_case_types": ["role-positive", "authority-negative", "permission-negative", "handoff", "evidence-gap"]
      }
    },
    {
      "agent_id": "driver-engineer",
      "role_contract": {
        "inputs": ["driver-requirements", "hardware-contract", "bringup-evidence"],
        "outputs": ["driver-change", "bringup-result", "hardware-risk-handoff"]
      },
      "permission_envelope": {
        "permission_profile": "code-write",
        "allowed_effects": ["read-only", "diagnostic-execution", "workspace-write"],
        "tool_capabilities": ["repository-read", "static-analysis", "diagnostic-command", "runtime-observation", "workspace-edit", "test-execution"]
      },
      "decision_authority": {
        "owned_domains_source": "manifest.agents[].owns",
        "non_owned_domains_source": "manifest.agents[].does_not_own",
        "may_recommend_outside_owned_domains": false,
        "must_escalate": ["product-scope-change", "unsafe-hardware-state", "release-signoff"]
      },
      "handoff": {
        "allowed_targets": ["test-validation-engineer", "code-review-governor"],
        "required_payload": ["change-summary", "bringup-evidence", "known-limitations"]
      },
      "required_evidence": ["hardware-source-reference", "deterministic-test-result", "failure-path-result"],
      "assumption_scope": {
        "allowed": ["verified-register-contract", "observed-board-state"],
        "must_not_assume": ["undocumented-silicon-behavior", "test-pass", "release-approval"]
      },
      "eval_suite": {
        "suite_id": "driver-engineer-value-v1",
        "required_case_types": ["role-positive", "authority-negative", "permission-negative", "handoff", "evidence-gap"]
      }
    },
    {
      "agent_id": "component-engineer",
      "role_contract": {
        "inputs": ["component-contract", "dependency-boundaries", "acceptance-criteria"],
        "outputs": ["component-change", "api-compatibility-result", "integration-handoff"]
      },
      "permission_envelope": {
        "permission_profile": "code-write",
        "allowed_effects": ["read-only", "diagnostic-execution", "workspace-write"],
        "tool_capabilities": ["repository-read", "static-analysis", "diagnostic-command", "runtime-observation", "workspace-edit", "test-execution"]
      },
      "decision_authority": {
        "owned_domains_source": "manifest.agents[].owns",
        "non_owned_domains_source": "manifest.agents[].does_not_own",
        "may_recommend_outside_owned_domains": false,
        "must_escalate": ["requirement-redefinition", "public-api-break", "release-strategy"]
      },
      "handoff": {
        "allowed_targets": ["test-validation-engineer", "code-review-governor"],
        "required_payload": ["change-summary", "contract-diff", "validation-result"]
      },
      "required_evidence": ["call-site-analysis", "behavioral-test-result", "compatibility-assessment"],
      "assumption_scope": {
        "allowed": ["declared-component-contract", "current-call-site-evidence"],
        "must_not_assume": ["downstream-compatibility", "implicit-requirement-change", "release-approval"]
      },
      "eval_suite": {
        "suite_id": "component-engineer-value-v1",
        "required_case_types": ["role-positive", "authority-negative", "permission-negative", "handoff", "evidence-gap"]
      }
    },
    {
      "agent_id": "application-engineer",
      "role_contract": {